{
  "schema_version": "0.2",
  "software_version": "0.2.0",
  "software_git_commit": "027e59f80de2acf7a63721585b7567e99b9c1b98",
  "code": {
    "n": 4,
    "generators": [
      "XXXX",
      "ZZZZ"
    ],
    "name": "Four-qubit CSS"
  },
  "code_input_hash": "4407fb45b8175b03193e43f402579e34718ffb7f544f2855f20a5cb246f1c5c6",
  "seed": 0,
  "configuration": {
    "budget": 4,
    "seed": 0,
    "strategy": "cegis",
    "target_dc": 3,
    "max_weight": 3,
    "max_combinations": 2000000,
    "beam_width": 12,
    "initial_population": 6,
    "idles": false,
    "decoder_weight": 1,
    "resource_limits": []
  },
  "memory_configuration": {
    "rounds": 2,
    "basis": "X",
    "logical_index": 0,
    "noisy_input": false
  },
  "fault_model": "repeated noisy extraction; ideal encoded input; physical product-basis final data readout",
  "initial_population_ids": [
    "e2378b2b63185649a3f6",
    "c51be77d027cb09db6d4",
    "66ea1b275f1f73a8d12e",
    "cf38049bb7ea324f9101"
  ],
  "evaluation_slots": 4,
  "unique_candidates_evaluated": 4,
  "candidates_evaluated": 4,
  "mutation_count": 0,
  "summary": {
    "best_dc_lower_bound": 2,
    "minimum_witness_weight_at_best_dc": 2,
    "minimum_witness_weight": 1,
    "best_resources_at_best_dc": {
      "Q": 5,
      "D": 34,
      "QD": 170,
      "two_q_gates": 16
    },
    "first_dc_tiers": {
      "1": {
        "evaluation": 1,
        "seconds": 0.004414699971675873
      },
      "2": {
        "evaluation": 1,
        "seconds": 0.004414699971675873
      }
    },
    "evaluations_to_target_dc": null,
    "time_to_target_dc": null,
    "best_QD_at_target_dc": null,
    "target_reached": false,
    "counterexamples_consumed": 0,
    "repairs_evaluated": 0,
    "repair_success_rate": null,
    "witness_elimination_rate": null
  },
  "frontier": [],
  "exploratory_frontier": [
    {
      "architecture_id": "e2378b2b63185649a3f6",
      "candidate": {
        "generating_basis": [
          "XXXX",
          "ZZZZ"
        ],
        "orders": [
          [
            0,
            1,
            2,
            3
          ],
          [
            0,
            1,
            2,
            3
          ]
        ],
        "flag_intervals": [
          [],
          []
        ],
        "check_order": [
          0,
          1
        ],
        "ancilla_assignment": [
          0,
          0
        ],
        "syndrome_budget": 1,
        "parallelism": 1
      },
      "resources": {
        "data_qubits": 4,
        "syndrome_ancillas": 1,
        "flag_ancillas": 0,
        "Q": 5,
        "one_q_gates": 12,
        "two_q_gates": 16,
        "measurements": 8,
        "resets": 4,
        "preparations": 0,
        "operation_count": 40,
        "D": 34,
        "QD": 170,
        "depth_lower_bound": 34,
        "schedule_efficiency": 1.0
      },
      "circuit_hash": "45b0773217092197890bddfb0e34d5a461a6846e545051fc74a6176ad0ec2219",
      "bounds": {
        "status": "EXACT",
        "lower_bound": 2,
        "upper_bound": 2,
        "excluded_through": 1,
        "witness": {
          "fault_count": 2,
          "faults": [
            {
              "operation": 3,
              "qubits": [
                4,
                0
              ],
              "label": "IY",
              "kind": "cx",
              "location": "op:3",
              "before": false,
              "round_index": 0,
              "check": 0,
              "role": "data_interaction",
              "interval": null,
              "interaction_position": 0
            },
            {
              "operation": 5,
              "qubits": [
                4,
                2
              ],
              "label": "IY",
              "kind": "cx",
              "location": "op:5",
              "before": false,
              "round_index": 0,
              "check": 0,
              "role": "data_interaction",
              "interval": null,
              "interaction_position": 2
            }
          ],
          "checks": [
            0
          ],
          "relation": "same-check",
          "hook_support": [
            0,
            2
          ],
          "flags_fired": false,
          "flag_information_cancelled": false,
          "logical_coset": 1,
          "detector_outcomes": 0,
          "flag_outcomes": 0,
          "final_data_pauli": "YIYI"
        },
        "reason": null,
        "combinations_examined": 1277,
        "fault_locations": 40,
        "fault_variants": 296,
        "requested_weight": 3
      },
      "rejection": "logical_witness_below_target",
      "stage": "C",
      "signature_seconds": 0.001167600043118,
      "fault_search_seconds": 0.00028419995214790106,
      "witness_verification": {
        "verified": true,
        "path": "boolean_array_simultaneous_replay"
      },
      "counterexample_analysis": {
        "counterexample_id": "a3eefec921a23686d732",
        "total_fault_weight": 2,
        "rounds": [
          0
        ],
        "checks": [
          0
        ],
        "round_relation": "same-round",
        "check_relation": "same-check",
        "data_hook_support": [],
        "hook_weight": 0,
        "implicated_intervals": [
          {
            "round": 0,
            "check": 0,
            "flag_interval": null,
            "interaction_position": 0,
            "monitored_intervals": [],
            "propagated_support": [
              0
            ]
          },
          {
            "round": 0,
            "check": 0,
            "flag_interval": null,
            "interaction_position": 2,
            "monitored_intervals": [],
            "propagated_support": [
              2
            ]
          }
        ],
        "flag_records_triggered": [],
        "flag_records_cancelled": [],
        "measurement_faults": 0,
        "reset_faults": 0,
        "idle_faults": 0,
        "shared_gadget": true,
        "independent_completion": false,
        "overlapping_gadgets": false,
        "failure_classes": [
          "OTHER"
        ]
      },
      "decoder": {
        "name": "bounded_minimum_weight_detector_logical_recovery",
        "training_completed_through": 1,
        "resolved": 296,
        "failures": 70,
        "examined": 296,
        "completed_through": 1,
        "reason": null,
        "witnesses": [
          {
            "faults": [
              {
                "operation": 3,
                "qubits": [
                  4,
                  0
                ],
                "label": "IY",
                "kind": "cx",
                "location": "op:3",
                "before": false,
                "round_index": 0,
                "check": 0,
                "role": "data_interaction",
                "interval": null,
                "interaction_position": 0
              }
            ],
            "detector_signature": 6,
            "actual_logical": 1,
            "recovery_logical": 0,
            "residual_logical": 1
          },
          {
            "faults": [
              {
                "operation": 3,
                "qubits": [
                  4,
                  0
                ],
                "label": "IZ",
                "kind": "cx",
                "location": "op:3",
                "before": false,
                "round_index": 0,
                "check": 0,
                "role": "data_interaction",
                "interval": null,
                "interaction_position": 0
              }
            ],
            "detector_signature": 4,
            "actual_logical": 1,
            "recovery_logical": 0,
            "residual_logical": 1
          },
          {
            "faults": [
              {
                "operation": 3,
                "qubits": [
                  4,
                  0
                ],
                "label": "XY",
                "kind": "cx",
                "location": "op:3",
                "before": false,
                "round_index": 0,
                "check": 0,
                "role": "data_interaction",
                "interval": null,
                "interaction_position": 0
              }
            ],
            "detector_signature": 4,
            "actual_logical": 1,
            "recovery_logical": 0,
            "residual_logical": 1
          },
          {
            "faults": [
              {
                "operation": 3,
                "qubits": [
                  4,
                  0
                ],
                "label": "XZ",
                "kind": "cx",
                "location": "op:3",
                "before": false,
                "round_index": 0,
                "check": 0,
                "role": "data_interaction",
                "interval": null,
                "interaction_position": 0
              }
            ],
            "detector_signature": 6,
            "actual_logical": 1,
            "recovery_logical": 0,
            "residual_logical": 1
          },
          {
            "faults": [
              {
                "operation": 3,
                "qubits": [
                  4,
                  0
                ],
                "label": "YY",
                "kind": "cx",
                "location": "op:3",
                "before": false,
                "round_index": 0,
                "check": 0,
                "role": "data_interaction",
                "interval": null,
                "interaction_position": 0
              }
            ],
            "detector_signature": 1,
            "actual_logical": 1,
            "recovery_logical": 0,
            "residual_logical": 1
          },
          {
            "faults": [
              {
                "operation": 3,
                "qubits": [
                  4,
                  0
                ],
                "label": "YZ",
                "kind": "cx",
                "location": "op:3",